{
  "sbf_protocol_contract": "1",
  "feature_id": "grpc-unary-profile",
  "feature_uid": "11111111-1111-4111-8111-111111111111",
  "protocol": {
    "family": "grpc",
    "dialect": "proto3-text"
  },
  "source": {
    "adapter": "protobuf-static",
    "adapter_revision": 1,
    "source_hash": "0b5cc247e3a8d5da7eb453919780fbe4dd6f7cc739e79e1f8a9c5eb56fbf1caa",
    "source_hash_basis": "raw-bytes",
    "files": [
      "orders.proto"
    ]
  },
  "planes": {
    "grpc": {
      "packages": [
        {
          "id": "grpc-package:aa24fb6bb5559f31c4cb",
          "name": "shop.v1",
          "file": "orders.proto",
          "line": 2
        }
      ],
      "services": [
        {
          "id": "grpc-service:64535db6514a7e655647",
          "name": "Orders",
          "file": "orders.proto",
          "line": 5
        }
      ],
      "methods": [
        {
          "id": "grpc-method:5ba7e68e08dc35bf2794",
          "service": "Orders",
          "name": "Get",
          "request_type": "Req",
          "response_type": "Res",
          "client_streaming": false,
          "server_streaming": false,
          "file": "orders.proto",
          "line": 5
        }
      ],
      "messages": [
        {
          "id": "grpc-message:52ed61b7b77f3b5bc4ca",
          "name": "Req",
          "fields": [
            {
              "type": "string",
              "name": "id",
              "number": 1,
              "file": "orders.proto",
              "line": 3
            }
          ],
          "file": "orders.proto",
          "line": 3
        },
        {
          "id": "grpc-message:d29f8eae15623d498087",
          "name": "Res",
          "fields": [
            {
              "type": "string",
              "name": "id",
              "number": 1,
              "file": "orders.proto",
              "line": 4
            }
          ],
          "file": "orders.proto",
          "line": 4
        }
      ]
    },
    "graphql": {
      "schemas": [],
      "types": [],
      "fields": [],
      "operations": []
    },
    "asyncapi": {
      "channels": [],
      "operations": [],
      "messages": []
    },
    "websocket": {
      "connections": [],
      "messages": []
    }
  },
  "warnings": [],
  "completeness": {
    "status": "partial",
    "service_count": 1,
    "method_count": 1,
    "message_count": 2,
    "note": "static .proto source only; descriptor options, imports and generated runtime behavior are not inferred"
  }
}
